{
  "index_version": "1.0",
  "repo": "PandaNetOS/smartpickcore",
  "generated_at": "2026-10-11",
  "current_iteration": "r03",
  "framework_version": "1.0",
  "levels": {
    "A": {
      "name": "结论性内容",
      "versioned": true,
      "field": "content_version",
      "reason": "随轮次演化、重复写错代价最高。文件内版本行 + 索引登记。"
    },
    "B": {
      "name": "结构性文档 / 框架与库代码",
      "versioned": true,
      "field": "content_version",
      "reason": "随框架演进但无『结论』性质。.md 加版本行；.py 只登记索引。"
    },
    "C": {
      "name": "机器契约",
      "versioned": false,
      "field": null,
      "reason": "已有 schema_version / config_version / data_version / version 字段，各答不同问题。索引镜像其值，不重复加版本。"
    },
    "D": {
      "name": "纯数据 / 分析脚本",
      "versioned": false,
      "field": null,
      "reason": "raw 数据用 SHA256（比版本号更强的保证）；分析脚本随结论归档，不单独版本化。"
    }
  },
  "entries": [
    {
      "path": "games/dlt/iterations/round02/FINDINGS.md",
      "level": "A",
      "kind": "iteration_artifact",
      "content_version": "1.0",
      "iteration": "r02",
      "note": "整理入库轮发现",
      "updated_at": "2026-10-11",
      "status": "active"
    },
    {
      "path": "games/dlt/iterations/round02/HANDOFF.md",
      "level": "A",
      "kind": "iteration_artifact",
      "content_version": "1.0",
      "iteration": "r02",
      "note": "r02→r03 交接",
      "updated_at": "2026-10-11",
      "status": "active"
    },
    {
      "path": "games/dlt/iterations/round02/PRIORITY_TASKS.md",
      "level": "A",
      "kind": "iteration_artifact",
      "content_version": "1.0",
      "iteration": "r02",
      "updated_at": "2026-10-11",
      "status": "active"
    },
    {
      "path": "games/dlt/iterations/round02/TASK_BRIEF.md",
      "level": "A",
      "kind": "iteration_artifact",
      "content_version": "1.0",
      "iteration": "r02",
      "note": "已交付",
      "updated_at": "2026-10-11",
      "status": "active"
    },
    {
      "path": "games/dlt/iterations/round02/known_errors.md",
      "level": "A",
      "kind": "iteration_artifact",
      "content_version": "1.0",
      "iteration": "r02",
      "note": "E1~E9 避坑手册",
      "updated_at": "2026-10-11",
      "status": "active"
    },
    {
      "path": "games/dlt/iterations/round02/legacy_findings/README.md",
      "level": "A",
      "kind": "iteration_artifact",
      "content_version": "1.0",
      "iteration": "r02",
      "note": "归档，设使用门槛",
      "updated_at": "2026-10-11",
      "status": "active"
    },
    {
      "path": "games/dlt/iterations/round02/legacy_findings/_round3_reference/round3_independent_review.html",
      "level": "A",
      "kind": "iteration_artifact",
      "content_version": "1.0",
      "iteration": "r02",
      "updated_at": "2026-10-11",
      "status": "archived",
      "note": "历史归档，设使用门槛（防锚定）"
    },
    {
      "path": "games/dlt/iterations/round02/legacy_findings/round2_deep_analysis.txt",
      "level": "A",
      "kind": "iteration_artifact",
      "content_version": "1.0",
      "iteration": "r02",
      "updated_at": "2026-10-11",
      "status": "archived",
      "note": "历史归档，设使用门槛（防锚定）"
    },
    {
      "path": "games/dlt/iterations/round02/legacy_findings/round2_glm_analysis.txt",
      "level": "A",
      "kind": "iteration_artifact",
      "content_version": "1.0",
      "iteration": "r02",
      "updated_at": "2026-10-11",
      "status": "archived",
      "note": "历史归档，设使用门槛（防锚定）"
    },
    {
      "path": "games/dlt/iterations/round02/legacy_findings/round2_main_report.md",
      "level": "A",
      "kind": "iteration_artifact",
      "content_version": "1.0",
      "iteration": "r02",
      "updated_at": "2026-10-11",
      "status": "archived",
      "note": "历史归档，设使用门槛（防锚定）"
    },
    {
      "path": "games/dlt/iterations/round02/legacy_findings/round2_verify_analysis.txt",
      "level": "A",
      "kind": "iteration_artifact",
      "content_version": "1.0",
      "iteration": "r02",
      "updated_at": "2026-10-11",
      "status": "archived",
      "note": "历史归档，设使用门槛（防锚定）"
    },
    {
      "path": "games/dlt/iterations/round03/FINDINGS.md",
      "level": "A",
      "kind": "iteration_artifact",
      "content_version": "1.0",
      "iteration": "r03",
      "note": "复核轮发现（含自我纠错）",
      "updated_at": "2026-10-11",
      "status": "active"
    },
    {
      "path": "games/dlt/iterations/round03/HANDOFF.md",
      "level": "A",
      "kind": "iteration_artifact",
      "content_version": "1.0",
      "iteration": "r03",
      "note": "r03→r04 交接",
      "updated_at": "2026-10-11",
      "status": "active"
    },
    {
      "path": "games/dlt/iterations/round03/TASK_BRIEF.md",
      "level": "A",
      "kind": "iteration_artifact",
      "content_version": "1.0",
      "iteration": "r03",
      "note": "已交付",
      "updated_at": "2026-10-11",
      "status": "active"
    },
    {
      "path": "games/dlt/iterations/round03/scripts/apply_r03_facts.py",
      "level": "A",
      "kind": "iteration_artifact",
      "content_version": "1.0",
      "iteration": "r02",
      "updated_at": "2026-10-11",
      "status": "active"
    },
    {
      "path": "games/dlt/iterations/round03/scripts/apply_r03_strategy.py",
      "level": "A",
      "kind": "iteration_artifact",
      "content_version": "1.0",
      "iteration": "r02",
      "updated_at": "2026-10-11",
      "status": "active"
    },
    {
      "path": "games/dlt/iterations/round03/scripts/b2_robust_estimators.json",
      "level": "A",
      "kind": "iteration_artifact",
      "content_version": "1.0",
      "iteration": "r02",
      "updated_at": "2026-10-11",
      "status": "active"
    },
    {
      "path": "games/dlt/iterations/round03/scripts/b2_robust_estimators.py",
      "level": "A",
      "kind": "iteration_artifact",
      "content_version": "1.0",
      "iteration": "r02",
      "updated_at": "2026-10-11",
      "status": "active"
    },
    {
      "path": "games/dlt/iterations/round03/scripts/b2_split_stability.json",
      "level": "A",
      "kind": "iteration_artifact",
      "content_version": "1.0",
      "iteration": "r02",
      "updated_at": "2026-10-11",
      "status": "active"
    },
    {
      "path": "games/dlt/iterations/round03/scripts/b2_split_stability.py",
      "level": "A",
      "kind": "iteration_artifact",
      "content_version": "1.0",
      "iteration": "r02",
      "updated_at": "2026-10-11",
      "status": "active"
    },
    {
      "path": "games/dlt/iterations/round03/scripts/cap_adjusted_uplift.json",
      "level": "A",
      "kind": "iteration_artifact",
      "content_version": "1.0",
      "iteration": "r02",
      "updated_at": "2026-10-11",
      "status": "active"
    },
    {
      "path": "games/dlt/iterations/round03/scripts/cap_adjusted_uplift.py",
      "level": "A",
      "kind": "iteration_artifact",
      "content_version": "1.0",
      "iteration": "r02",
      "updated_at": "2026-10-11",
      "status": "active"
    },
    {
      "path": "games/dlt/iterations/round04/TASK_BRIEF.md",
      "level": "A",
      "kind": "iteration_artifact",
      "content_version": "1.0",
      "iteration": "r04",
      "note": "planned",
      "updated_at": "2026-10-11",
      "status": "active"
    },
    {
      "path": "games/dlt/rules_history.md",
      "level": "A",
      "kind": "rules_history",
      "content_version": "1.0",
      "iteration": "r02",
      "note": "E0~E6 共 7 段（§3.3 措辞已标记存疑）",
      "updated_at": "2026-10-11",
      "status": "active"
    },
    {
      "path": "games/dlt/strategy/STRATEGY_GUIDE.md",
      "level": "A",
      "kind": "strategy_guide",
      "content_version": "1.0",
      "iteration": "r03",
      "note": "面向普通读者的策略说明书（人话版）",
      "updated_at": "2026-10-11",
      "status": "active"
    },
    {
      "path": "memory/INDEX.md",
      "level": "A",
      "kind": "index",
      "content_version": "1.0",
      "iteration": "r02",
      "note": "记忆层说明",
      "updated_at": "2026-10-11",
      "status": "active"
    },
    {
      "path": "memory/facts/FACTS.jsonl",
      "level": "A",
      "kind": "fact_ledger",
      "content_version": "1.1",
      "iteration": "r03",
      "note": "18 条结论（F-0001~F-0018；F-0015 superseded）",
      "updated_at": "2026-10-11",
      "status": "active"
    },
    {
      "path": "memory/facts/INDEX.md",
      "level": "A",
      "kind": "fact_index",
      "content_version": "1.1",
      "iteration": "r03",
      "note": "派生物，由 cli index 生成",
      "updated_at": "2026-10-11",
      "status": "active"
    },
    {
      "path": "memory/journal/round02.md",
      "level": "A",
      "kind": "journal",
      "content_version": "1.0",
      "iteration": "r02",
      "note": "整理入库轮",
      "updated_at": "2026-10-11",
      "status": "active"
    },
    {
      "path": "memory/journal/round03.md",
      "level": "A",
      "kind": "journal",
      "content_version": "1.0",
      "iteration": "r03",
      "note": "复核轮（含 1 次自我纠错）",
      "updated_at": "2026-10-11",
      "status": "active"
    },
    {
      "path": "memory/lessons/LESSONS.md",
      "level": "A",
      "kind": "lesson_library",
      "content_version": "1.1",
      "iteration": "r03",
      "note": "L1–L12，只增不删（r03 新增 L10–L12）",
      "updated_at": "2026-10-11",
      "status": "active"
    },
    {
      "path": "memory/workbench/HYPOTHESES.md",
      "level": "A",
      "kind": "workbench",
      "content_version": "1.0",
      "iteration": "r02",
      "note": "H-001~H-005",
      "updated_at": "2026-10-11",
      "status": "active"
    },
    {
      "path": "memory/workbench/OPEN_QUESTIONS.md",
      "level": "A",
      "kind": "workbench",
      "content_version": "1.1",
      "iteration": "r03",
      "note": "10 问，3 answered（Q-001/Q-002/Q-004）",
      "updated_at": "2026-10-11",
      "status": "active"
    },
    {
      "path": "memory/workbench/TODO.md",
      "level": "A",
      "kind": "workbench",
      "content_version": "1.2",
      "iteration": "r03",
      "note": "P0 已清空；T-043 已销账",